<?xml-model href="../schemas/schema-1.xsd"?>
<Offers xmlns:xsi="http://www.w3.org/2001/XMLSchema-instance" xsi:noNamespaceSchemaLocation="../schemas/schema-1.xsd">
    <Offer>
        <Id>0</Id>
        <FromDate>2021-05-01</FromDate>
        <ToDate>2021-05-09</ToDate>
        <Price>50.49</Price>
        <DiscountRate>0.1</DiscountRate>
        <Availability>120</Availability>
        <Description xml:lang="en">Up to 30kgs can be bought at once</Description>
        <Store>
            <Id>0</Id>
            <Address>Prosecka 115 Praha 9</Address>
            <OpeningHours xml:lang="en">Mo-Su 7:00-20:00</OpeningHours>
            <Rating>
                <Id>0</Id>
                <StarRating>4</StarRating>
            </Rating>
            <Rating>
                <Id>1</Id>
                <StarRating>3</StarRating>
            </Rating>
            <Vendor>
                <Id>0</Id>
                <Name>Tesco</Name>
                <Dic>2222</Dic>
                <Rating>
                    <Id>0</Id>
                    <StarRating>4</StarRating>
                </Rating>
                <Rating>
                    <Id>1</Id>
                    <StarRating>3</StarRating>
                </Rating>
                <Picture>
                    <Id>1</Id>
                    <Height>100</Height>
                    <Width>100</Width>
                    <Uri>https://tesco.cz/logo</Uri>
                </Picture>
            </Vendor>
        </Store>
        <Product>
            <Id>0</Id>
            <Name xml:lang="en">Apple</Name>
            <Ean>1111</Ean>
            <Description xml:lang="en">Fresh and Tasty</Description>
            <Rating>
                <Id>0</Id>
                <StarRating>4</StarRating>
            </Rating>
            <Rating>
                <Id>1</Id>
                <StarRating>3</StarRating>
            </Rating>
            <Picture>
                <Id>2</Id>
                <Height>100</Height>
                <Width>100</Width>
                <Uri>https://agrofert.cz/apple/pic</Uri>
            </Picture>
            <Category>
                <Id>1</Id>
                <InternalName xml:lang="en">Fruit</InternalName>
                <SynonymName xml:lang="cs">Ovoce</SynonymName>
                <SynonymName xml:lang="vi">Hoa Qua</SynonymName>
                <ParentCategory>
                    <Id>0</Id>
                    <InternalName xml:lang="en">Fresh</InternalName>
                    <SynonymName xml:lang="cs">Cerstve</SynonymName>
                    <SynonymName xml:lang="vi">Tuoi</SynonymName>
                </ParentCategory>
            </Category>
            <Producer>
                <Id>0</Id>
                <Name>Agrofert</Name>
                <Dic>1234</Dic>
                <Rating>
                    <Id>0</Id>
                    <StarRating>4</StarRating>
                </Rating>
                <Rating>
                    <Id>0</Id>
                    <StarRating>4</StarRating>
                </Rating>
                <Rating>
                    <Id>1</Id>
                    <StarRating>3</StarRating>
                </Rating>
                <Picture>
                    <Id>5</Id>
                    <Height>100</Height>
                    <Width>100</Width>
                    <Uri>https://agrofert.cz/logo</Uri>
                </Picture>
                <ProductionCapacity>100000</ProductionCapacity>
            </Producer>
        </Product>
    </Offer>
    <Offer>
        <Id>1</Id>
        <FromDate>2021-05-01</FromDate>
        <ToDate>2021-05-09</ToDate>
        <Price>20.0</Price>
        <DiscountRate>0.0</DiscountRate>
        <Availability>200</Availability>
        <Store>
            <Id>1</Id>
            <Address>Pisecna 5038 Chomutov</Address>
            <OpeningHours xml:lang="en">Mo-Su 9:00-18:00</OpeningHours>
            <Rating>
                <Id>2</Id>
                <StarRating>2</StarRating>
            </Rating>
            <Vendor>
                <Id>0</Id>
                <Name>Tesco</Name>
                <Dic>2222</Dic>
                <Rating>
                    <Id>0</Id>
                    <StarRating>4</StarRating>
                </Rating>
                <Rating>
                    <Id>1</Id>
                    <StarRating>3</StarRating>
                </Rating>
                <Picture>
                    <Id>1</Id>
                    <Height>100</Height>
                    <Width>100</Width>
                    <Uri>https://tesco.cz/logo</Uri>
                </Picture>
            </Vendor>
        </Store>
        <Product>
            <Id>2</Id>
            <Name xml:lang="en">Milk</Name>
            <Ean>3333</Ean>
            <Description xml:lang="en">Organic milk</Description>
            <Picture>
                <Id>3</Id>
                <Height>100</Height>
                <Width>100</Width>
                <Uri>https://agrofert.cz/milk/pic</Uri>
            </Picture>
            <Category>
                <Id>2</Id>
                <InternalName xml:lang="en">Drinks</InternalName>
                <SynonymName xml:lang="cs">Napoje</SynonymName>
            </Category>
            <Producer>
                <Id>0</Id>
                <Name>Agrofert</Name>
                <Dic>1234</Dic>
                <Rating>
                    <Id>0</Id>
                    <StarRating>4</StarRating>
                </Rating>
                <Rating>
                    <Id>0</Id>
                    <StarRating>4</StarRating>
                </Rating>
                <Rating>
                    <Id>1</Id>
                    <StarRating>3</StarRating>
                </Rating>
                <Picture>
                    <Id>5</Id>
                    <Height>100</Height>
                    <Width>100</Width>
                    <Uri>https://agrofert.cz/logo</Uri>
                </Picture>
                <ProductionCapacity>100000</ProductionCapacity>
            </Producer>
        </Product>
    </Offer>
    <Offer>
        <Id>2</Id>
        <FromDate>2021-05-02</FromDate>
        <ToDate>2021-05-07</ToDate>
        <Price>15.49</Price>
        <DiscountRate>0.3</DiscountRate>
        <Availability>100</Availability>
        <Store>
            <Id>2</Id>
            <Address>Makrovska 1 Praha</Address>
            <OpeningHours xml:lang="en">Mo-Su 8:00-20:00</OpeningHours>
            <Vendor>
                <Id>1</Id>
                <Name>Makro</Name>
                <Dic>3333</Dic>
                <Rating>
                    <Id>2</Id>
                    <StarRating>2</StarRating>
                </Rating>
                <Picture>
                    <Id>0</Id>
                    <Height>100</Height>
                    <Width>100</Width>
                    <Uri>https://makro.cz/logo</Uri>
                </Picture>
            </Vendor>
        </Store>
        <Product>
            <Id>1</Id>
            <Name xml:lang="en">Pilsner Beer</Name>
            <Ean>2222</Ean>
            <Description xml:lang="en">Authentic Czech beer</Description>
            <Rating>
                <Id>2</Id>
                <StarRating>2</StarRating>
            </Rating>
            <Picture>
                <Id>4</Id>
                <Height>100</Height>
                <Width>100</Width>
                <Uri>https://pilsner.cz/beer/pic</Uri>
            </Picture>
            <Category>
                <Id>3</Id>
                <InternalName xml:lang="en">Alcohol</InternalName>
                <SynonymName xml:lang="cs">Alkohol</SynonymName>
                <ParentCategory>
                    <Id>2</Id>
                    <InternalName xml:lang="en">Drinks</InternalName>
                    <SynonymName xml:lang="cs">Napoje</SynonymName>
                </ParentCategory>
            </Category>
            <Producer>
                <Id>1</Id>
                <Name>Pilsner</Name>
                <Dic>2345</Dic>
                <Rating>
                    <Id>2</Id>
                    <StarRating>2</StarRating>
                </Rating>
                <Picture>
                    <Id>6</Id>
                    <Height>100</Height>
                    <Width>100</Width>
                    <Uri>https://pilsner.cz/logo</Uri>
                </Picture>
                <ProductionCapacity>100000</ProductionCapacity>
            </Producer>
        </Product>
    </Offer>
</Offers>